{
  "type": "rcp.provider_capability",
  "rcp_version": "0.1",
  "provider": "demo:enterprise",
  "capability_version": "1",
  "capabilities": {
    "identity": "allow",
    "interaction_metadata": "allow",
    "content": "deny",
    "provider_context": "limited",
    "external_processing": "limited",
    "secure_envelope": "allow",
    "revocation_events": "allow",
    "policy_events": "allow"
  },
  "limitation_refs": {
    "provider_context":["demo:enterprise:policy:managed-context-v1"],
    "external_processing":["demo:enterprise:policy:external-processing-v1"]
  },
  "processing_locations": ["provider"],
  "issued_at": "2026-10-05T00:00:00Z"
}
