{
  "type": "rcp.provider_capability",
  "rcp_version": "0.1",
  "provider": "demo:meeting",
  "capability_version": "1",
  "capabilities": {
    "identity": "allow",
    "interaction_metadata": "allow",
    "content": "limited",
    "provider_context": "allow",
    "external_processing": "limited",
    "secure_envelope": "allow",
    "revocation_events": "allow",
    "policy_events": "allow"
  },
  "limitation_refs": {
    "content":["demo:meeting:policy:transcript-consent-v1"],
    "external_processing":["demo:meeting:policy:processing-location-v1"]
  },
  "processing_locations": ["provider", "device"],
  "issued_at": "2026-10-05T00:00:00Z"
}
